{
  "$schema": "../schema/CanTp.schema.json",
  "module": "CanTp",
  "flowControlSection": [
    "フロー制御パラメータ (AUTOSAR CanTp N_USData.req の N_Ar, N_Bs, N_Cr)"
  ],
  "blockSize": {
    "value": 0,
    "doc": [
      "ブロックサイズ (BS): 0 = ブロック間 FC なし (すべての CF を連続送信)"
    ]
  },
  "stMin": {
    "value": 0,
    "doc": [
      "最小分離時間 (STmin): 0 = CF 間の最小待ち時間なし"
    ]
  },
  "timeoutSection": [
    "タイムアウト値 (ms)",
    "ISO 15765-2 Table 8: N_Ar / N_Br / N_Cr / N_Bs / N_Cs"
  ],
  "nCrTimeoutMs": {
    "value": 1000,
    "doc": [
      "N_Cr タイムアウト: 次の CF を受信するまでの最大待機時間 (ms)",
      "ISO 15765-2 Table 8 の標準値である 1000ms を採用する。"
    ]
  },
  "nBsTimeoutMs": {
    "value": 5000,
    "doc": [
      "N_Bs タイムアウト: FF 送信後に FC を受信するまでの最大待機時間 (ms)",
      "ISO 15765-2 Table 8 の標準値は 1000ms だが、手動テスト (Cangaroo で FC を",
      "手動送信) に対応するため、本実装ではあえて長い 5000ms に設定している。"
    ]
  },
  "nAsTimeoutMs": {
    "value": 1000,
    "doc": [
      "N_As タイムアウト: CF の物理送信が同期的に失敗し続けた場合に、そのまま",
      "無期限リトライさせずセッションを中断するまでの最大許容時間 (ms)。",
      "本実装は非同期の TxConfirmation 経路が常に E_OK 固定（Can.c/CanIf.c 参照）",
      "で真の N_As（送信確認待ち）を表現できないため、代わりに",
      "Can_Write() の同期的な送信失敗が一定時間継続した場合の保護として用いる。"
    ]
  },
  "idSection": [
    "PDU / N-SDU ID"
  ],
  "pdurTxSrcPdu": {
    "pdu": "DiagResp_Tx",
    "doc": [
      "CanTp が診断応答フレームを送信する際に使用する PduR TX SrcPduId",
      "（PduR.json の txPaths の name から求めたシンボリック名。CAN 0x7E8 の経路）。"
    ]
  },
  "txSduId": {
    "value": 0,
    "doc": [
      "Dcm が CanTp_Transmit() に渡す TX N-SDU ID (診断応答チャネル)"
    ]
  },
  "rxSduId": {
    "value": 0,
    "doc": [
      "CanTp_RxIndication() が受け取る RX N-SDU ID (診断要求チャネル)"
    ]
  },
  "dcmRxPduId": {
    "value": 0,
    "doc": [
      "Dcm_StartOfReception() / Dcm_CopyRxData() / Dcm_TpRxIndication() に渡す、Dcm の RX I-PDU の ID。"
    ]
  },
  "dcmTxPduId": {
    "value": 0,
    "doc": [
      "Dcm_CopyTxData() / Dcm_TpTxConfirmation() に渡す、Dcm の TX I-PDU の ID。"
    ]
  }
}
